{
  "edge_type": "ReadLAPSPassword",
  "description": "Read the local administrator password from ms-Mcs-AdmPwd (LAPS) on a computer object.",
  "static_noise_score": 30,
  "telemetry": [
    {
      "source": "windows_security",
      "event_id": 4662,
      "detail": "Directory Service Access reading the LAPS attribute - requires object SACL auditing on the computer (default OFF).",
      "reliability": "high_if_auditing_enabled",
      "default_enabled": false
    },
    {
      "source": "edr_heuristic",
      "product_class": "MDI",
      "detail": "ITDR (MDI) and some EDRs flag anomalous LAPS reads, especially at volume.",
      "reliability": "medium"
    }
  ],
  "mitre_technique": "T1555",
  "prerequisite_privilege": "ReadLAPSPassword / All-Extended-Rights on the computer object",
  "abuse_primitive": "Read ms-Mcs-AdmPwd, then use the local admin password to move to the host.",
  "notes": "A read, so it is quiet by default. Loud only where LAPS-attribute auditing (4662) or MDI LAPS modelling is present."
}
