{
  "edge_type": "ForceChangePassword",
  "description": "Reset the target user's password without knowing the current one.",
  "static_noise_score": 45,
  "telemetry": [
    {
      "source": "windows_security",
      "event_id": 4724,
      "detail": "An attempt was made to reset an account's password - default-on, high fidelity for privileged targets.",
      "reliability": "high",
      "default_enabled": true
    },
    {
      "source": "windows_security",
      "event_id": 4738,
      "detail": "User account changed (pwdLastSet) - accompanies the reset.",
      "reliability": "medium",
      "default_enabled": true
    },
    {
      "source": "edr_heuristic",
      "product_class": "generic",
      "detail": "Resetting a privileged account's password is disruptive (the real user is locked out) and commonly alerted; noisier than shadow creds.",
      "reliability": "high"
    }
  ],
  "mitre_technique": "T1098",
  "prerequisite_privilege": "User-Force-Change-Password extended right (or GenericAll)",
  "abuse_primitive": "Reset target password, authenticate as target.",
  "notes": "4724 is on by default. Louder than AddKeyCredentialLink because it changes state the legitimate user will notice. Prefer shadow creds where the target object supports it."
}
