{
  "edge_type": "ADCSESC7",
  "description": "ManageCA / ManageCertificates rights on the CA, enabling the operator to enable ESC6 or approve their own requests.",
  "static_noise_score": 55,
  "telemetry": [
    {
      "source": "windows_security",
      "event_id": 4624,
      "detail": "Logon to the CA context to exercise management rights.",
      "reliability": "low",
      "default_enabled": true
    },
    {
      "source": "windows_security",
      "event_id": 4886,
      "detail": "Certificate Services received a certificate request (on the CA).",
      "reliability": "high",
      "default_enabled": true
    },
    {
      "source": "windows_security",
      "event_id": 4887,
      "detail": "Certificate Services issued a certificate (on the CA).",
      "reliability": "high",
      "default_enabled": true
    },
    {
      "source": "windows_security",
      "event_id": 4768,
      "detail": "PKINIT TGT request using the issued certificate - certificate-logon anomaly.",
      "reliability": "medium",
      "default_enabled": true
    },
    {
      "source": "edr_heuristic",
      "product_class": "generic",
      "detail": "Toggling the EDITF SAN flag or approving pending requests are CA-management actions that mature monitoring flags.",
      "reliability": "high"
    }
  ],
  "mitre_technique": "T1649",
  "prerequisite_privilege": "ManageCA or ManageCertificates on the enterprise CA",
  "abuse_primitive": "Enable EDITF_ATTRIBUTESUBJECTALTNAME2 (-> ESC6) or approve a held malicious request.",
  "notes": "A capability edge: it enables ESC6-style abuse. The configuration change to the CA is the loud, high-fidelity moment."
}
