{
  "edge_type": "ReadGMSAPassword",
  "description": "Read the gMSA managed password blob (msDS-ManagedPassword) and derive the account's keys.",
  "static_noise_score": 30,
  "telemetry": [
    {
      "source": "windows_security",
      "event_id": 4662,
      "detail": "DS Access reading msDS-ManagedPassword - requires object auditing (default OFF).",
      "reliability": "high_if_auditing_enabled",
      "default_enabled": false
    },
    {
      "source": "edr_heuristic",
      "product_class": "MDI",
      "detail": "gMSA password retrieval by an unexpected principal is modelled by newer ITDR.",
      "reliability": "medium"
    }
  ],
  "mitre_technique": "T1555",
  "prerequisite_privilege": "PrincipalsAllowedToRetrieveManagedPassword on the gMSA",
  "abuse_primitive": "Read the managed password blob (e.g. GMSAPasswordReader/Certipy), compute NT hash / AES keys.",
  "notes": "Quiet read by default; the derived credential's later use is usually the louder half of the chain."
}
